{
  "memory_mode": "structured_evidence",
  "planning_mode": "experiment_verify",
  "enabled_tools": [
    "retrieval",
    "ucr",
    "citation_rail"
  ],
  "max_provider_calls": 3,
  "max_retries": 1,
  "profile": "experiment_first",
  "selection_reason": "deterministic selection for experiment_first"
}
